{
  "case_id": "OWNER-EXP-A-ENV-001",
  "result": "FAIL",
  "previous_runs": [],
  "device": "SYNTH-AP-01",
  "sw_version": "synthetic-build-1",
  "assertion": "Association timed out before link establishment",
  "syslog_excerpt": "owner_experience_test synthetic excerpt: AP reachability probe failed; no real device log.",
  "env": {
    "AP_reachable": false,
    "AC_reachable": true
  },
  "retry": "not_executed",
  "provenance": {
    "dataset_version": "owner-experience-test-v1.1",
    "synthetic": true,
    "source": "owner_experience_test"
  }
}
